ResourceID,brocade.id,card,order,source_field,Description,Description Type,Description Language
fa5c64e2-be9f-560d-a55a-b0622a56d203,tg:lhdc:2625,e73_Descriptions,,id.desc,Hoorspel door K. Jonckheere,descriptive note,Nederlands
4f5559fa-c980-5f75-bc74-dab61b2635cd,tg:lhdc:3247,e73_Descriptions,,id.desc,Door Edmonda Nelly,descriptive note,Nederlands
31d9c1c7-1cd0-50d2-93f9-85d8416a352d,tg:lhdc:4201,e73_Descriptions,,id.desc,Door Paul Ableman,descriptive note,Nederlands
16d7217c-73d6-50b4-ad6a-ac9d0353f613,tg:lhdc:1427,e73_Descriptions,,id.desc,"Een stereo-luisterspel van Walter Van De Broeck en vele, vele anderen  
(In opdracht van de BRT)",descriptive note,Nederlands
7812c568-50ce-50b0-be68-d87f86742abf,tg:lhdc:2635,e73_Descriptions,,id.desc,Door Karel Liberati,descriptive note,Nederlands
035eb8ae-e944-5690-baf3-a02dfb8e919a,tg:lhdc:916,e73_Descriptions,,id.desc,"Van Dorothy en Campell Christie   
Deel 1",descriptive note,Nederlands
a62c4bc7-52ac-5f29-ac6d-907cef5606ac,tg:lhdc:4273,e73_Descriptions,,id.desc,Vrolijke komedie door R.E. Mitchel,descriptive note,Nederlands
207ffe1c-17a5-54ec-8c6a-0d261c85516e,tg:lhdc:1455,e73_Descriptions,,id.desc,"Luisterspel door Hermann Rossmann uit het Duits vertaald door  
Staf Knop",descriptive note,Nederlands
ce21d488-c706-5390-8e41-4d1ae6e917ba,tg:lhdc:185,e73_Descriptions,,id.desc,Artikel verschenen in de 'Gazet van Antwerpen',descriptive note,Nederlands
da016d3b-8bcb-5f52-aae1-25b90f3c4b87,tg:lhdc:2647,e73_Descriptions,,id.desc,Naar een Russisch sprookje door Gerda Gevers,descriptive note,Nederlands
85e1cc87-cc69-5724-9e23-c50dc2165960,tg:lhdc:1445,e73_Descriptions,,id.desc,Knipsels,descriptive note,Nederlands
3497c571-615f-53e6-bc9f-9c931230621c,tg:lhdc:195,e73_Descriptions,,id.desc,"werken van David Teniers, Rubens, Jan Steen, Poussin",descriptive note,Nederlands
c643d7ec-3584-5452-8301-c71132bff1a6,tg:lhdc:974,e73_Descriptions,,id.desc,Ontvangbewijs i.v.m. bruiklenen uit de privéverzameling van Rooses. En 2 krantenknipsels betreffende de Jordaenstentoonstelling.,descriptive note,Nederlands
dff1ccf1-dfd2-59d0-888c-02ba295ccef3,tg:lhdc:1200,e73_Descriptions,,id.desc,Voor de radio bewerkt door Pros Verbruggen,descriptive note,Nederlands
7b5c3a12-79bd-5dd3-9953-6b4b010202e8,tg:lhdc:3518,e73_Descriptions,,id.desc,Luisterspel voor paastid door Lou Mourik,descriptive note,Nederlands
2a0c83bb-c9b5-583b-9a58-51c24dbfaaee,tg:lhdc:1378,e73_Descriptions,,id.desc,Door Hans Arno Joachim,descriptive note,Nederlands
782fc26c-fa03-5283-9ff9-c5bff39ec8e4,tg:lhdc:1210,e73_Descriptions,,id.desc,Door Morna Stuart,descriptive note,Nederlands
3bb498ac-425e-5127-9b8c-db97d765cf8d,tg:lhdc:3508,e73_Descriptions,,id.desc,Door Ben Loog,descriptive note,Nederlands
11ebbcfd-16de-50fe-8804-77a19bbba5b5,tg:lhdc:2002,e73_Descriptions,,id.desc,"Een luisterspel van Micheal OhAodha naar het gelijknamige verhaal van  
Seamus O'Kelly. uit het Engels vertaald door Willy Courteaux",descriptive note,Nederlands
1311a32f-d08f-5f42-8b66-27267956abb3,tg:lhdc:1166,e73_Descriptions,,id.desc,"Een luisterspel , de inaugurasie herdenkend van den eersten spoorweg  
van den Belgie door Michel De Ghelderode  
Brusselse bewerking van Renaat Grassin",descriptive note,Nederlands
b9b0ab1e-3e50-55b9-b861-3d14927b2292,tg:lhdc:3706,e73_Descriptions,,id.desc,Luisterspel voor de kinderen door Ad van Seijen,descriptive note,Nederlands
f430e033-b6ad-5c3b-a64f-08c03a87a7c2,tg:lhdc:67,e73_Descriptions,,id.desc,Programma van het Eldorado in Parijs,descriptive note,Nederlands
1862d558-c545-56ab-a0be-f4b5f2b3c7ca,tg:lhdc:1987,e73_Descriptions,,id.desc,"Een luisterspel door Samuel Beckett, Nederlandse bewerking door Hugo Claus",descriptive note,Nederlands
c56edab5-893c-5636-82aa-0482a75ab4c3,tg:lhdc:2374,e73_Descriptions,,id.desc,Een luisterspel van Guy Didelez,descriptive note,Nederlands
58f5a5f7-006a-59ad-812c-53fd1375f620,tg:lhdc:1176,e73_Descriptions,,id.desc,Radioschets door Tristan Bernard vertaald door Yvonne De Man,descriptive note,Nederlands
dfdb4738-22ea-5ee0-a87b-f150331a5fab,tg:lhdc:4750,e73_Descriptions,,id.desc,Luisterspel door Marc Decorte,descriptive note,Nederlands
140ed740-6e5c-56b9-9c6f-9c15de6b9372,tg:lhdc:1997,e73_Descriptions,,id.desc,"Een zweeds luisterspel van Peder Sjoegren. Nederlandse vertaling van  
Paul Vroom",descriptive note,Nederlands
a5c6f8b1-b3b4-5f86-96c8-7c1d0e60d414,tg:lhdc:2364,e73_Descriptions,,id.desc,Door Ireneusz Iredynski,descriptive note,Nederlands
fb671c44-4a86-578a-b696-7f7f32f7db62,tg:lhdc:77,e73_Descriptions,,id.desc,"Programma van de Folies-Bergère, Parijs",descriptive note,Nederlands
1dfcdf31-b70c-5877-96dd-f7b1e90dfc10,tg:lhdc:4628,e73_Descriptions,,id.desc,Deel II 1910. Boek 4,descriptive note,Nederlands
ca9b5c93-8ce4-550f-8c09-22d56abc223e,tg:lhdc:2521,e73_Descriptions,,id.desc,"Een radiodocumentaire van Helmut Kopetzky. Nederlandse vertaling en  
regie: Flor Stein",descriptive note,Nederlands
1e755052-9926-545f-a25f-667474cf7ad8,tg:lhdc:2449,e73_Descriptions,,id.desc,Door Ivan Mandy,descriptive note,Nederlands
5df5ea7f-1430-51a9-a29b-586d66fc6179,tg:lhdc:1723,e73_Descriptions,,id.desc,Luisterspel van Karin Ewert. Nederlandse vertaling: Marry Riemens,descriptive note,Nederlands
23b5c436-9bb8-54ba-aa0d-f39bdf5ae1b4,tg:lhdc:2531,e73_Descriptions,,id.desc,Luisterspel van Ben Caldwell. Vertaling: Coert Poort,descriptive note,Nederlands
756707e6-9aca-59e4-be60-cde4626af97a,tg:lhdc:1846,e73_Descriptions,,id.desc,"Door Carlo Goldoni, vertaling: Louis Povel; radiobewerking en Regie:  
herman Niels",descriptive note,Nederlands
3fdc87ea-3e8a-5209-a085-87e22520866a,tg:lhdc:1856,e73_Descriptions,,id.desc,Luisterspel door Gunter Eich. uit het Duits vertaald door Nora snijers,descriptive note,Nederlands
1df910a8-1c6d-5e2c-baa7-f8c1f86fe255,tg:lhdc:4691,e73_Descriptions,,id.desc,Luisterspel door Julia Tulkens.,descriptive note,Nederlands
d7ab901e-7118-5f7c-9924-0d1970a3d1f9,tg:lhdc:567,e73_Descriptions,,id.desc,Luisterspel door G.K. Saunders,descriptive note,Nederlands
eb46f73e-a692-5ad7-bc1b-9c6b4a90a7cb,tg:lhdc:3873,e73_Descriptions,,id.desc,Luisterspel voorde jeugd door J.D. Mertens-Beirinckx,descriptive note,Nederlands
826056ed-2b12-56d5-9bd8-c6127468b0c8,tg:lhdc:2598,e73_Descriptions,,id.desc,Een radiodocumentaire van Niels Peter Juel Larsen,descriptive note,Nederlands
faa7641c-eb3c-59d9-b6b1-6845124ba913,tg:lhdc:3863,e73_Descriptions,,id.desc,"Luisterspel naar Duits van Wolfgang Ecke, bewerkt door S. Bulke",descriptive note,Nederlands
346305d1-ecc5-5e31-abaf-d475c3608761,tg:lhdc:2588,e73_Descriptions,,id.desc,Een radiodocumentaire van Carita Backstrom,descriptive note,Nederlands
7108c22b-9059-503c-9188-8050d2e5a028,tg:lhdc:1594,e73_Descriptions,,id.desc,Door Lucia Ibertay,descriptive note,Nederlands
7cbb8c26-0366-55d6-a3d0-858290b27caa,tg:lhdc:2796,e73_Descriptions,,id.desc,Door Andrée Nicolas,descriptive note,Nederlands
88493e92-ec8a-5a15-88a8-7ed14c5aec2a,tg:lhdc:1584,e73_Descriptions,,id.desc,Door Vittorio Minnucci,descriptive note,Nederlands
9807badb-a45b-56f9-8ea8-b9e6ccfd8fdf,tg:lhdc:769,e73_Descriptions,,id.desc,"Derde deel   
J.B. Priestley",descriptive note,Nederlands
785a6cde-b18b-5c42-9c7d-0f1ae101026c,tg:lhdc:2932,e73_Descriptions,,id.desc,Door Eva Vermeer,descriptive note,Nederlands
ff3e5ada-999e-5cd6-ba26-9e804609299e,tg:lhdc:611,e73_Descriptions,,id.desc,Hongaars luisterspel van Gyorgy Kompanyi,descriptive note,Nederlands
41200f67-859a-5228-bd28-ae2fe2caa1ab,tg:lhdc:779,e73_Descriptions,,id.desc,"Bert van Aerschot 
Luisterspelwedstrijd 1952",descriptive note,Nederlands
a996d9d8-ef1c-51d3-9f46-af933ca8bee2,tg:lhdc:601,e73_Descriptions,,id.desc,Een luisterspel van Lode Weyk,descriptive note,Nederlands
9230b0d7-a58d-57eb-a784-0fab80958628,tg:lhdc:1685,e73_Descriptions,,id.desc,Mini-luisterspel door Cornelis Baan,descriptive note,Nederlands
432355c4-951b-5945-828d-66a7901789d1,tg:lhdc:2487,e73_Descriptions,,id.desc,Luisterspel van Eduard König. Nederlandse vertaling: Eva Vermeer,descriptive note,Nederlands
662519ab-20d2-5968-ab21-f4c6a61ed070,tg:lhdc:3814,e73_Descriptions,,id.desc,Gevariëerd luisterspel door Lia Lucassen,descriptive note,Nederlands
473c4669-eea8-5b39-bfc9-09e2088d6542,tg:lhdc:478,e73_Descriptions,,id.desc,"Luisterspel door Erwin Wickert  
Uit het Duits vertaald door J.L. De Belder",descriptive note,Nederlands
e3371f3f-93c8-524d-84b7-923225de4fd8,tg:lhdc:1831,e73_Descriptions,,id.desc,"Zweeds luisterspel van Stig Dagerman. nederlandse vertaling: Paul De  
Wispelaere",descriptive note,Nederlands
d6851f65-6e75-5307-9593-98a8d19dd1b7,tg:lhdc:500,e73_Descriptions,,id.desc,"Luisterspel van Hans Kasper  
Uit het Duits vertaald door Ward Ruyslinck",descriptive note,Nederlands
d14f805c-5489-5631-8254-547ff36f7e81,tg:lhdc:1949,e73_Descriptions,,id.desc,Tekst van P.R. Mortier. muziek van Marinus de Jong,descriptive note,Nederlands
f6c605fc-73a7-5740-bd86-7ed7f9f4cd4e,tg:lhdc:1821,e73_Descriptions,,id.desc,"Tsjechisch luisterspel van Jaromir Ptacek. uit het Duits vertaald door  
Carlos Tindemans",descriptive note,Nederlands
12b406ac-010b-594c-813b-f56611709059,tg:lhdc:468,e73_Descriptions,,id.desc,"Luisterspel door Leopold Ahlsen  
Uit het Duits vertaald door Carlos Tindemans",descriptive note,Nederlands
8035665a-8d45-5cb6-8634-c9bd72572062,tg:lhdc:1959,e73_Descriptions,,id.desc,Van Karel Van De Woestijne voor de radio bewerkt door Herman Teirlinck,descriptive note,Nederlands
0ae25dda-fb56-56d3-b3e3-15741554b055,tg:lhdc:510,e73_Descriptions,,id.desc,"Een luisterspel door Leif Panduro  
Uit het Duits vertaald door Jeroen Brouwers",descriptive note,Nederlands
1dd64792-8860-5485-b93e-91c92351c5c8,tg:lhdc:666,e73_Descriptions,,id.desc,Hoorspel door Z.E.H. Werenfried van Straaten,descriptive note,Nederlands
c400c843-c3f3-583a-9001-d26f01f8d580,tg:lhdc:4590,e73_Descriptions,,id.desc,Televisieserie naar motieven van de roman van Herman Teirlinck,descriptive note,Nederlands
68b67728-af17-5d82-a0fa-5e72e38f005a,tg:lhdc:2955,e73_Descriptions,,id.desc,Door R. Carane,descriptive note,Nederlands
96ee4668-4a87-5000-a23e-41837da63e7a,tg:lhdc:4580,e73_Descriptions,,id.desc,Door John Buydens,descriptive note,Nederlands
552c5f90-69d9-5c15-acdb-e9e9023449a9,tg:lhdc:2689,e73_Descriptions,,id.desc,Luisterspel door Gerda Gevers; bewerking naar Andersen,descriptive note,Nederlands
d47b1bd8-ccf9-50cd-b245-c86eebdc6c09,tg:lhdc:3383,e73_Descriptions,,id.desc,Door Fang Wan Gwee,descriptive note,Nederlands
dd28d98a-cf93-51cc-849e-dea3a049ff4c,tg:lhdc:3393,e73_Descriptions,,id.desc,Door Wolfgang Ecke,descriptive note,Nederlands
ccfccd92-55a1-593f-b499-5ecfd20d344f,tg:lhdc:1277,e73_Descriptions,,id.desc,Door Eugeen Vermeiren,descriptive note,Nederlands
90695f8c-2e60-5403-8633-b5bbb84357ec,tg:lhdc:4529,e73_Descriptions,,id.desc,Auteur: Marc De Bie,descriptive note,Nederlands
46bb8a13-b999-5f20-b75e-be7c5b623e5c,tg:lhdc:2065,e73_Descriptions,,id.desc,Luisterspel door Hans Kasper; uit het Duits vertaald door Hubert Lampo,descriptive note,Nederlands
3fe5ace6-a2a2-5aed-81b9-c443a117b142,tg:lhdc:4539,e73_Descriptions,,id.desc,Auteur: Marc De Bie,descriptive note,Nederlands
a2e1c729-5910-543b-9367-3b7527bce2db,tg:lhdc:4204,e73_Descriptions,,id.desc,Door Carlo Goldoni,descriptive note,Nederlands
d13c8c33-c882-54b3-9a9b-53c811cdbfb8,tg:lhdc:1422,e73_Descriptions,,id.desc,"Een luisterspel van David Ellis. Nederlanse vertaling van Jan en   
Baetrice Verstraete-Vanhaelewijn",descriptive note,Nederlands
f3e195cc-c75e-51d9-9e2c-27279a7725b8,tg:lhdc:3242,e73_Descriptions,,id.desc,Door Fred de Craemer,descriptive note,Nederlands
988759fb-9197-5250-90b5-7b8ef6781b0b,tg:lhdc:913,e73_Descriptions,,id.desc,"Luisterspel in vijf bedrijven en een naspel.   
Tekst van P.R. Mortier   
Muziek van Marinus De Jong",descriptive note,Nederlands
0a84f02a-2522-5387-a20e-eb128d9fbc91,tg:lhdc:2758,e73_Descriptions,,id.desc,Door Robert Depret,descriptive note,Nederlands
f1f54fb8-12dd-508b-aace-01231d288ff8,tg:lhdc:4214,e73_Descriptions,,id.desc,(When the wind blows) van Peter Nichols,descriptive note,Nederlands
76e95d88-e19e-5df9-ae45-6cf1e3f04f1b,tg:lhdc:1432,e73_Descriptions,,id.desc,Luisterspel van Michal Tonecki. Nederlandse vertaling: Karel Ruyssinck,descriptive note,Nederlands
c229eed6-656a-5c00-be1b-4e01dc25d8c3,tg:lhdc:2620,e73_Descriptions,,id.desc,Door Vicotr E. Wyndheim,descriptive note,Nederlands
61d82960-6690-5b57-a101-54c28dafebb6,tg:lhdc:903,e73_Descriptions,,id.desc,"Een klankbeeld, gewijd aan de eenmaal zo   
gevreesde pokziekte en aan haar groten bestrijder   
Edward Jenner.   
Door William Hoffman",descriptive note,Nederlands
2e754b72-00c9-559b-9d33-47374fe13ee1,tg:lhdc:3124,e73_Descriptions,,id.desc,Door Godelieve Vordoodt,descriptive note,Nederlands
0c579867-ec4b-54ed-baac-0f5531513462,tg:lhdc:4162,e73_Descriptions,,id.desc,Van Von Edward Bond,descriptive note,Nederlands
d0f127e9-6a9e-5264-814e-b1721149e313,tg:lhdc:2556,e73_Descriptions,,id.desc,Luisterspel van Miklos Gyarfas. Vertaling: Erika Dedinszky,descriptive note,Nederlands
fb7aa473-0bfd-55c7-9272-4f30f94247b9,tg:lhdc:1754,e73_Descriptions,,id.desc,Uit bundel gedemonteerde stukken. Financiële stukken en briefwisseling gericht aan Rooses.,descriptive note,Nederlands
4e48d2f6-7800-54d3-a07e-066f01c199ff,tg:lhdc:4172,e73_Descriptions,,id.desc,Televisie Mysteriespel van Jan D.M de Kock,descriptive note,Nederlands
6e91900a-ed3a-5315-86e3-fa56911ebc8e,tg:lhdc:2546,e73_Descriptions,,id.desc,"Luisterspel door Colin Shaw. uit het Engels vertaald door Mark F.  
Belloy",descriptive note,Nederlands
7a79b340-1bf1-57f3-82c8-22b96b1ca088,tg:lhdc:1888,e73_Descriptions,,id.desc,Luisterspel van De Waal Venter. nederlandse vertaling: Marcel Leemans,descriptive note,Nederlands
e90c1ad9-562a-5e3a-94d0-c203c0932a8d,tg:lhdc:3771,e73_Descriptions,,id.desc,Gevariëerd luisterspel,descriptive note,Nederlands
28642749-6af9-5899-9514-e5557b193f21,tg:lhdc:1111,e73_Descriptions,,id.desc,Bewerkt door Willem Smulders Pr,descriptive note,Nederlands
1cfd7137-38e6-5137-8a3c-2f5d3a38fbca,tg:lhdc:4737,e73_Descriptions,,id.desc,Een luisterspel door Lia Timmermans,descriptive note,Nederlands
099aebb4-7726-54fb-8b07-7d681b6d6656,tg:lhdc:10,e73_Descriptions,,id.desc,Quadri eerste laag,descriptive note,Nederlands
2a665d81-98ed-5bf3-8d86-e5c3864b6432,tg:lhdc:2303,e73_Descriptions,,id.desc,Een B.R.T Radiodocumentaire gerealiseerd door Michel De Sutter,descriptive note,Nederlands
acef27ed-0448-52e4-9296-7c23f3401b98,tg:lhdc:3609,e73_Descriptions,,id.desc,"Een jeugdtoneel door Willy Pittoors. Radiobewerking: Tom Mans, Tony  
van Looy",descriptive note,Nederlands
16cd4531-8233-552d-8aea-af3a56985fa3,tg:lhdc:1101,e73_Descriptions,,id.desc,Luisterspel door Ernst Johannsen,descriptive note,Nederlands
d8ebb845-ebf3-5046-a951-b2f7b9266e98,tg:lhdc:4727,e73_Descriptions,,id.desc,Een luisterspel door Marc Sleen.,descriptive note,Nederlands
c73b2f02-036d-5bc3-8da6-b3178e822129,tg:lhdc:1898,e73_Descriptions,,id.desc,Een luisterspel van Francis Durbridge. Nederlandse vertaling: Guy Bernaert,descriptive note,Nederlands
aaa3caa2-0dcd-5f77-bee7-7936d7fa3c43,tg:lhdc:3761,e73_Descriptions,,id.desc,"Luisterspel door W.E. Jojns, voor de radio bewrkt door Chris Carlsen.  
Pseudoniem voor Chris De Houwer",descriptive note,Nederlands
5c33202b-6504-571c-9e35-35d9d5209038,tg:lhdc:1079,e73_Descriptions,,id.desc,luisterspel van Emmerich Kadar,descriptive note,Nederlands
965aa8ee-a608-529b-a548-e257c12b3450,tg:lhdc:2313,e73_Descriptions,,id.desc,Een luisterspel door James G. Harris. Vertaling: Adriaan Ceelen,descriptive note,Nederlands
c48dc6da-950f-53d9-bf2e-2e4c7b601aa7,tg:lhdc:3619,e73_Descriptions,,id.desc,Ie deel luisterspel voor de jeugd door Mary Manco,descriptive note,Nederlands
64cd9a84-02e5-5d17-be99-4fe978cad79b,tg:lhdc:4755,e73_Descriptions,,id.desc,"Luisterspel naar een gelijknamige Kerstvertelling van Felix Timmermans voor  
de radio bewerkt door Frans Verstreken. (Uit Kerstboek 1932)",descriptive note,Nederlands
8717773d-36ca-5a1f-8494-c386fd8178c1,tg:lhdc:3713,e73_Descriptions,,id.desc,Luisterspel door Zr.Maria-Jozefa Willems,descriptive note,Nederlands
0cfc59db-34fd-5edc-9707-e3197ddcc917,tg:lhdc:72,e73_Descriptions,,id.desc,"Programma van het Garrick Theatre, Londen",descriptive note,Nederlands
aa8b6c30-983d-5cfe-8ff7-5a17db54a098,tg:lhdc:1992,e73_Descriptions,,id.desc,Pools luisterspel van Michal Tonecki. Nederlandse vertaling: Coos Mulder,descriptive note,Nederlands
f15c382a-0add-5fb1-ab04-80afeff2173a,tg:lhdc:2209,e73_Descriptions,,id.desc,"Luisterspel door Rodney Quest. Uit het Engels vertaald door Ria  
Scarphout",descriptive note,Nederlands
8af64b20-5c09-5c61-bb4e-fe417238bdf6,tg:lhdc:3703,e73_Descriptions,,id.desc,Luisterspel voor de jeugd door Mary Manco,descriptive note,Nederlands
ba8b55f5-3b21-52c4-9d6a-aab8c100699c,tg:lhdc:1163,e73_Descriptions,,id.desc,Door H. Herrmann,descriptive note,Nederlands
0e081eb2-21d8-5ae9-9061-42ebf073d713,tg:lhdc:4745,e73_Descriptions,,id.desc,Een poëtische fantasie in de vorm van een luisterspel door J. Van Ackere,descriptive note,Nederlands
93929dcf-08d9-5b95-bc0f-adc92681c3a5,tg:lhdc:1982,e73_Descriptions,,id.desc,"Luisterspel door Sheila Hodgson, uit het Engels vertaald door Valeer Van  
Kerkhove",descriptive note,Nederlands
dace3d9a-fcc8-5934-9bc6-2039cb1ea2f8,tg:lhdc:62,e73_Descriptions,,id.desc,Programma van het Casino de Paris,descriptive note,Nederlands
ef5fb8c4-9698-55ec-9f4e-ee7223623336,tg:lhdc:4100,e73_Descriptions,,id.desc,Vlaamse televisie door Luc De Smet,descriptive note,Nederlands
a65ee471-a227-567e-b7f1-b9e1c882f8c9,tg:lhdc:3146,e73_Descriptions,,id.desc,Door Godelieve Verdoodt,descriptive note,Nederlands
7db8d6a1-2c4e-5b0e-b50d-7bfc17b75c52,tg:lhdc:4078,e73_Descriptions,,id.desc,Spel van Herman Heijermans,descriptive note,Nederlands
bf06412e-90fd-5955-b0ec-ccb941fe6f5f,tg:lhdc:2534,e73_Descriptions,,id.desc,Luisterspel van Ireneusz Iredynski. vertaling: Lisetta Stembor,descriptive note,Nederlands
faba4735-8866-5f66-a56f-937f7ccae9de,tg:lhdc:3156,e73_Descriptions,,id.desc,Door Felix De Moor,descriptive note,Nederlands
cb51166a-c601-59b9-8729-2870b79c5e36,tg:lhdc:1736,e73_Descriptions,,id.desc,"Een luisterspel door Hans Rehfisch. Uit het Duits vertaald door  
Christne d'Haen",descriptive note,Nederlands
e22e9f9f-4965-5175-b0de-ca0cf6425ce8,tg:lhdc:4110,e73_Descriptions,,id.desc,Filmscenario: Roger Van Ransbeek,descriptive note,Nederlands
b9549c98-7e57-531e-913c-2d70acb7c6d8,tg:lhdc:2524,e73_Descriptions,,id.desc,Een luisterspel van Helmut Eisendle; vertaald door Adinda Ricourt,descriptive note,Nederlands
3fe80358-4cf5-5b40-b1ab-ed485864d1da,tg:lhdc:4068,e73_Descriptions,,id.desc,Door Miguel Mihura,descriptive note,Nederlands
aa2f8d8d-23c0-5cd8-a87d-711435a84796,tg:lhdc:809,e73_Descriptions,,id.desc,"Luisterspel in vijf toneelspelen 
Door Hermynia zur Muhlen - Fik Collet",descriptive note,Nederlands
2482a1c0-b06b-5bab-8392-9f65439c9393,tg:lhdc:4266,e73_Descriptions,,id.desc,Televisiespel  door Jerome Kilty,descriptive note,Nederlands
5e53109e-2a3a-567f-8a9a-8617e4057486,tg:lhdc:1440,e73_Descriptions,,id.desc,"Een luisterspel van Gunter Eich, uit het Duits vertaald door Jozef Van Hoeck",descriptive note,Nederlands
b861a0da-291d-56c9-ad78-1878ded47eed,tg:lhdc:3358,e73_Descriptions,,id.desc,Door Friedrich Feld,descriptive note,Nederlands
50442ea4-1fa3-5d31-8b9a-f9ed6fba653d,tg:lhdc:971,e73_Descriptions,,id.desc,"Contract avec l'imprimeur Bulletin/rekeningen"" en briefwisseling",descriptive note,Nederlands
909db23e-8ae1-5b44-a440-4946dd5c4fb0,tg:lhdc:1538,e73_Descriptions,,id.desc,"Toneelspel in twee bedrijven en een tussenspel door Thomas Stearns  
Eliot werd vertaald door Michel van de Plas",descriptive note,Nederlands
a25e95d0-ebf1-5d6c-bc00-3faa1658f5a4,tg:lhdc:4276,e73_Descriptions,,id.desc,"Een romantisch blijspel door N. Richard Nash. Vertaling uit het  
Amerikaans: Nel Bergmans-Withaar.",descriptive note,Nederlands
1083136e-2ad1-592c-a253-0f9e82ed7de6,tg:lhdc:1450,e73_Descriptions,,id.desc,"Door Lydia Ragosin; uit het Engels vertaald door  
Hubert Van Herreweghen",descriptive note,Nederlands
2eced46a-e58c-5acc-9246-8dcf9b662098,tg:lhdc:180,e73_Descriptions,,id.desc,Interview met Jef Geeraerts verschenen in Humo,descriptive note,Nederlands
13f1c74b-21b4-50b6-b4ad-fe6bb1c99735,tg:lhdc:819,e73_Descriptions,,id.desc,"Door Gordon Ireland   
Vertaald en bewerkt door Raymond Brulez",descriptive note,Nederlands
9515d9ae-adba-5bee-955c-5cae466d3ab1,tg:lhdc:1528,e73_Descriptions,,id.desc,Luisterspel van Theo Peeters,descriptive note,Nederlands
fa461626-53f9-5abf-a786-39bedd0469bb,tg:lhdc:3475,e73_Descriptions,,id.desc,Door Els van Breemen,descriptive note,Nederlands
aed5a100-4b76-5602-bd3d-a74143b3ba3d,tg:lhdc:2007,e73_Descriptions,,id.desc,Luisterspel van Sebastien Goy. Uit het Duits vertaald door Jeroen Brouwers,descriptive note,Nederlands
039dfb54-f9d1-50d5-aa04-801d1ed4af99,tg:lhdc:1205,e73_Descriptions,,id.desc,"Can Stephen Vincent Benet uit het Fransch vertaald en bewerkt  
door: Georgette De Rijcke",descriptive note,Nederlands
20b3de59-6a4b-5e78-84d5-3781fa90ccc6,tg:lhdc:2017,e73_Descriptions,,id.desc,"Door C.F. Ramuz, Nederlandes vertaling door Paul Van Keymeulen.  
Radioaanpassing Geo H. Blanc muziek van Jean Binet  
",descriptive note,Nederlands
3a51644b-e13e-5658-a228-16c327521049,tg:lhdc:129,e73_Descriptions,,id.desc,"Aankondiging geïllustreerde volksuitgave De fanfare ""De St Jansvrienden"" in opdracht van *N.V. Standaard-Boekhandel*.",descriptive note,Nederlands
d09f759e-3aeb-50c7-89f1-92ea611d82f1,tg:lhdc:2793,e73_Descriptions,,id.desc,Door Robert Carane,descriptive note,Nederlands
dcd50913-31f6-5dfd-8492-0d752e879f4c,tg:lhdc:1581,e73_Descriptions,,id.desc,Van J.M. Synge,descriptive note,Nederlands
d2ce1f54-4168-5002-87dc-3df801b38969,tg:lhdc:1591,e73_Descriptions,,id.desc,Vorstin der Nederlanden. Door Maria Rompaey-De Lannoy,descriptive note,Nederlands
10f6e71c-5147-5f79-89d7-5d5a9104843a,tg:lhdc:2927,e73_Descriptions,,id.desc,Door Friedrich Feld,descriptive note,Nederlands
50aab79b-6f94-5a2b-abeb-3121a37ba6d2,tg:lhdc:604,e73_Descriptions,,id.desc,"Een luisterspel door Edmund Niziurski  
Uit het Duits vertaald door Georgette De Rycke",descriptive note,Nederlands
94d4bcae-09fb-51bd-b562-797269996030,tg:lhdc:614,e73_Descriptions,,id.desc,Luisterspel door Liliane Bruylants,descriptive note,Nederlands
5b17a80b-bac6-5b4a-8fe6-87cec8099485,tg:lhdc:1853,e73_Descriptions,,id.desc,"Luisterspel door Marie-Luise Kaschnitz. uit het Duits vertaald door Carlos  
Tindemans",descriptive note,Nederlands
b1536489-323a-5a50-8b76-6c5a8aeeabc9,tg:lhdc:4694,e73_Descriptions,,id.desc,Een luisterspel door Julia Tulkens,descriptive note,Nederlands
13e06019-ccbb-5172-8f6e-253b09e1affa,tg:lhdc:562,e73_Descriptions,,id.desc,"door Stefan Zweig,  
voor de radio bewerkt door Mevr. V. Dille - Lobe  
muzikale aanpassing: door E.H. Denijs - Dille
",descriptive note,Nederlands
584ee87a-1fa4-5f3a-8317-35cbdcc8bd08,tg:lhdc:1843,e73_Descriptions,,id.desc,Luisterspel door Staff Mangelschott,descriptive note,Nederlands
982229c3-63d6-5915-8116-3ce7c4d6f569,tg:lhdc:4684,e73_Descriptions,,id.desc,Luisterspel door: Julia Tulkens,descriptive note,Nederlands
18b83ebe-c3ff-5595-8ad9-9b0dfde668b0,tg:lhdc:572,e73_Descriptions,,id.desc,"Zuidafrikaans luisterspel door Chris Barnard  
Nederlandse bewerking door Jozef van Hoeck",descriptive note,Nederlands
4bfecf08-cc69-54fd-b78b-406f403fc10a,tg:lhdc:4830,e73_Descriptions,,id.desc,Tweetalige folder voor een tentoonstelling van de groep Abdij van 25 mei tot 2 juni,descriptive note,Nederlands
dacfed9a-db5b-5e67-aa33-460693348c09,tg:lhdc:3097,e73_Descriptions,,id.desc,Door Godelieve Verdoodt,descriptive note,Nederlands
389c6243-e68b-5323-8ffd-da7153a00dcb,tg:lhdc:3882,e73_Descriptions,,id.desc,Door Mary Manco,descriptive note,Nederlands
79fa602c-88a2-5ad8-b0b8-207c8720785e,tg:lhdc:2569,e73_Descriptions,,id.desc,Door Jaroslav Hasek. Bewrkt door J. Lemaire en A. Suls,descriptive note,Nederlands
6db71a3f-292f-5861-a747-ba92c7ba6ca7,tg:lhdc:1603,e73_Descriptions,,id.desc,"Uit bundel gedemonteerde stukken. 
Ook enkele brieven met musea over Rubens' werk.",descriptive note,Nederlands
a1478d77-bac4-51bd-a8ae-48aceadb5911,tg:lhdc:4025,e73_Descriptions,,id.desc,Een science finction TV-spel,descriptive note,Nederlands
d6d6a94d-4a6f-5942-8ce7-f7d9604c21e5,tg:lhdc:3892,e73_Descriptions,,id.desc,Door Gil van der Heyden,descriptive note,Nederlands
0f256a33-bcb0-519d-832e-ea476c81db3c,tg:lhdc:2401,e73_Descriptions,,id.desc,Een luisterspel van Béatrice Audry,descriptive note,Nederlands
a09fa34d-996c-5fab-a0cc-9249439878ac,tg:lhdc:1613,e73_Descriptions,,id.desc,Door G.L. Weisz,descriptive note,Nederlands
777f3e01-6169-5abb-8391-b7253fd69df5,tg:lhdc:4035,e73_Descriptions,,id.desc,Televisiespel door Herman De Coninck,descriptive note,Nederlands
5eb37d49-9ba3-54aa-8d7f-259633a57d2e,tg:lhdc:2579,e73_Descriptions,,id.desc,Een luisterspel van Ky. vertaling & bewerking: Hugo Meert,descriptive note,Nederlands
ed20da83-6cd9-5630-b91d-cfe83e3364ff,tg:lhdc:4708,e73_Descriptions,,id.desc,Hoorspel door Maria De Lannoy,descriptive note,Nederlands
45f6eaf9-4341-5c82-817e-388d152e4304,tg:lhdc:3636,e73_Descriptions,,id.desc,Luisterspel voor de jeugd,descriptive note,Nederlands
7974c1df-1c22-5ca8-a494-73fccbde28b0,tg:lhdc:4670,e73_Descriptions,,id.desc,Luisterspel door Julia Tulkens,descriptive note,Nederlands
92ef9c95-4fc1-5e4b-b88c-6ce537cf2d8e,tg:lhdc:4718,e73_Descriptions,,id.desc,De ramen open luisterspel door Aster Berkhof,descriptive note,Nederlands
ae010ecf-a729-5d6f-9edf-ce7ac9a9552a,tg:lhdc:2254,e73_Descriptions,,id.desc,Uit bundel gedemonteerde stukken. Doc. Platen/prenten van Jordaens voor de catalogus. Geannoteerd door Rooses.,descriptive note,Nederlands
bdb0ef5d-edec-597d-90e7-8624bd601bcb,tg:lhdc:1046,e73_Descriptions,,id.desc,"Luisterspel door Desmond Orr, uit het Engels vertaald door  
Georgette De Rijcke",descriptive note,Nederlands
