ResourceID,brocade.id,card,order,source_field,Description,Description Type,Description Language
1a01f892-1d20-5857-8606-7391544f8557,tg:lhdc:861,e73_Descriptions,,id.desc,Door Jac Ballings,descriptive note,Nederlands
0efbab10-fee1-5ca3-b086-d070ec17ae80,tg:lhdc:1428,e73_Descriptions,,id.desc,"Een geval van misdaad. Een stereo-spel van Volker W. Degener  
Nederlandse vertaling: Jan van den Weghe",descriptive note,Nederlands
69a9376b-2ac3-5fa8-8899-5e4c3b3ea591,tg:lhdc:704,e73_Descriptions,,id.desc,van Felix van Zijl,descriptive note,Nederlands
0d2e6757-295d-5ecf-b269-24d6a27573b1,tg:lhdc:2827,e73_Descriptions,,id.desc,Door René Metzemaekers,descriptive note,Nederlands
fa2dfe6c-4399-5daa-b5fe-02603bc38873,tg:lhdc:714,e73_Descriptions,,id.desc,Radioluisterspel van Antoon Coolen,descriptive note,Nederlands
b08b8890-0cda-593b-8f03-7b7e60d81f4d,tg:lhdc:2693,e73_Descriptions,,id.desc,"Door Robert Carane, uit het Frans vertaald door Jozef Kadijk",descriptive note,Nederlands
261de24b-915a-50ae-adc4-46fbb1e9ad52,tg:lhdc:3399,e73_Descriptions,,id.desc,Door Theo Luysterburg,descriptive note,Nederlands
b5b15d38-757f-52a3-9f9b-5f951c2ac0bb,tg:lhdc:1481,e73_Descriptions,,id.desc,"Luisterspel van Frederick Bradnum.  
Nederlandse vertaling: Adriaan Ceelen",descriptive note,Nederlands
d0de5670-77c7-5e8b-82f0-7b2f1fb6ef0d,tg:lhdc:3389,e73_Descriptions,,id.desc,Door Willy Wedekint,descriptive note,Nederlands
51a22134-56e9-5ecd-b083-b1c76cb24485,tg:lhdc:1491,e73_Descriptions,,id.desc,Luisterspel van Jiri Klobouk,descriptive note,Nederlands
8ea0dc6d-0993-5957-a5d6-d46d62605509,tg:lhdc:3966,e73_Descriptions,,id.desc,Door Francois Billetdoux. Nederlandse vertaling: Bernard Kemp,descriptive note,Nederlands
6a396e33-42f1-5b99-811a-8048d21b506a,tg:lhdc:237,e73_Descriptions,,id.desc,"Foto van de cover van ""Verzamelde gedichten"" van Karel van de Woestijne. De foto is bijgewerkt voor publicatie",descriptive note,Nederlands
c8106a49-2b6d-5563-85b1-956df29ec427,tg:lhdc:3187,e73_Descriptions,,id.desc,Door Theo Luysterburg,descriptive note,Nederlands
42e880cf-e077-5a81-89ff-5a2e194df411,tg:lhdc:3976,e73_Descriptions,,id.desc,Televisiespel in drie bedrijven,descriptive note,Nederlands
37dc7282-d954-509d-8b55-c08ad3d0d5a4,tg:lhdc:1953,e73_Descriptions,,id.desc,Luisterspel van Henk Van Kerkwijk,descriptive note,Nederlands
c6ab4bf7-8ec6-5385-8da5-b0cb9f835393,tg:lhdc:462,e73_Descriptions,,id.desc,"luisterspel door Jean Morris
Uit het Engels vertaald door 
Bernard Kemp",descriptive note,Nederlands
287f1471-242f-58a8-952f-ba6943cbe27d,tg:lhdc:1943,e73_Descriptions,,id.desc,Luisterspel uit de tropen,descriptive note,Nederlands
2324bbd5-3433-55df-9713-5931879675f6,tg:lhdc:1931,e73_Descriptions,,id.desc,"Luisterspel door Friedrich Dürrenmaat. Uit het Duits vertaald door Carlos  
Tindemans",descriptive note,Nederlands
be6abf9f-649d-53ef-874c-eb2a49c26768,tg:lhdc:578,e73_Descriptions,,id.desc,Luisterspel door Lode Vandeput,descriptive note,Nederlands
eeb76df2-83dd-5b53-a722-9a1c3898fd54,tg:lhdc:1849,e73_Descriptions,,id.desc,Luisterspel door Lode Vandeput,descriptive note,Nederlands
9b11ba27-8539-52cc-8915-9b996774f32d,tg:lhdc:1921,e73_Descriptions,,id.desc,Door Edith Mikeleitis; uit Duits vertaald door Pieter G. Buckinx,descriptive note,Nederlands
b9870cf8-45a1-5910-8e89-a72ffe7e6d8d,tg:lhdc:1859,e73_Descriptions,,id.desc,"Fins luisterspel van Juha Mannerkorpi, uit het Duits vertaald door  
Jeroen Brouwers",descriptive note,Nederlands
61f1f745-beba-54a6-a228-7c9a87813664,tg:lhdc:2597,e73_Descriptions,,id.desc,"Een fictionele documentaire van David Mc Robbie. Vertaling en regie:  
Ludo Schat",descriptive note,Nederlands
661a146b-2d41-586a-ac40-c5f8177db257,tg:lhdc:3914,e73_Descriptions,,id.desc,"Luisterspel voor kinderen door Friedrich Feld. Nederlandse  
bewerking: Tony van Looy  
",descriptive note,Nederlands
b07da22b-6557-5ef1-95f0-b0c1f26f9a8b,tg:lhdc:2587,e73_Descriptions,,id.desc,Auteur: Nick McCarthy,descriptive note,Nederlands
ee4389af-137d-575d-86ea-f225622cc9f1,tg:lhdc:1795,e73_Descriptions,,id.desc,Luisterspel door Max Frisch. nederlandse vertaling: Hubert Van Herreweghen,descriptive note,Nederlands
d0f3d6bf-c86c-567f-bb9e-af102abb8c52,tg:lhdc:133,e73_Descriptions,,id.desc,Brevet in opdracht van de *Vlaamsche Toeristenbond*.,descriptive note,Nederlands
9df4cbe2-fb15-5eaa-bfe8-34ee61956ae7,tg:lhdc:2789,e73_Descriptions,,id.desc,Door Theo Luysterburg,descriptive note,Nederlands
943caa8a-6b6d-5106-bfca-a85b495e47a8,tg:lhdc:3293,e73_Descriptions,,id.desc,Door Elly Constantina,descriptive note,Nederlands
3f3c561f-e510-5dcc-a034-e6442f972515,tg:lhdc:123,e73_Descriptions,,id.desc,De voorpagina van *'t Vlaams Pluimveeblad* met publiciteit voor *Graanhandel Zeelandia*.,descriptive note,Nederlands
2f5a7684-275d-543b-87b0-b999dc84ffff,tg:lhdc:766,e73_Descriptions,,id.desc,"Tweede deel
Naar het toneelstuk van Ch. Cordier   
Vertaling door Jozef Helsen   
Micro-aanpassing : Robert Maes  

",descriptive note,Nederlands
4c9da2d6-b611-5f68-9335-a7beeb18cef5,tg:lhdc:4490,e73_Descriptions,,id.desc,Aflevering 4,descriptive note,Nederlands
a49042ed-689e-5508-83b9-76534259c4b4,tg:lhdc:776,e73_Descriptions,,id.desc,"Peter De Smet
Luisterspeelwedstrijd 1952",descriptive note,Nederlands
796b044e-688b-594c-bed7-a3de1f8be1e0,tg:lhdc:4480,e73_Descriptions,,id.desc,Aflevering 21,descriptive note,Nederlands
dd5609ca-9129-58ae-8a46-45eaf1c0ef90,tg:lhdc:4304,e73_Descriptions,,id.desc,Sektie: Hubert Van herreweghen,descriptive note,Nederlands
6b0d9c75-71c1-50b9-ba0f-ab2cbfc157fa,tg:lhdc:1522,e73_Descriptions,,id.desc,"zweeds luisterspel van Birger Norman. Nederlandse vertaling:  
Marc van Cauteren",descriptive note,Nederlands
8d26e77b-b4d5-5145-bb29-bfbf1bc87388,tg:lhdc:813,e73_Descriptions,,id.desc,"Door Josef Martin Bauer,
vertaald door Hub. van Herreweghen",descriptive note,Nederlands
5fd2d81b-7cc9-5f82-91da-f5b3689f2d03,tg:lhdc:4314,e73_Descriptions,,id.desc,"Een serie kortverhalen. 2. Wouter, Karl en Marjan",descriptive note,Nederlands
5972415f-01be-5e94-a9e2-f70bbfb4400c,tg:lhdc:1532,e73_Descriptions,,id.desc,Van harold Pinter. Nederlandse vertaling: Coos Mulder,descriptive note,Nederlands
d227ff61-b5fe-5dbc-b73b-2f885a9794e8,tg:lhdc:803,e73_Descriptions,,id.desc,"Luisterspel door Jef Mennekens
",descriptive note,Nederlands
9bfe6693-2041-559a-9a8e-d6b600339ac6,tg:lhdc:2720,e73_Descriptions,,id.desc,Door Frans Hanssens,descriptive note,Nederlands
c3fa4bce-f83c-530f-9b61-771a19b0a62f,tg:lhdc:4551,e73_Descriptions,,id.desc,8e aflevering van een feuilleton door Marc De Bie,descriptive note,Nederlands
00e75a16-b5d6-559b-933b-da69683f2ca6,tg:lhdc:1377,e73_Descriptions,,id.desc,Door Walter Tritsch en G.L. Weisz,descriptive note,Nederlands
8c199e02-8784-5e68-b73e-44fc76c24a16,tg:lhdc:4541,e73_Descriptions,,id.desc,"Verhelle"". Auteur: Marc De Bie",descriptive note,Nederlands
c993ed34-9457-5d7f-a2ad-4b90a0416cf5,tg:lhdc:2994,e73_Descriptions,,id.desc,Door Robert Carane,descriptive note,Nederlands
b7d25eb1-b395-5c75-a0e4-c073801297c5,tg:lhdc:1367,e73_Descriptions,,id.desc,Door Thomas Moly,descriptive note,Nederlands
6f7c8778-a613-546e-9d2d-64942ec921bf,tg:lhdc:3507,e73_Descriptions,,id.desc,Door F Florizoone. luisterspel: Het zonneuurwerk,descriptive note,Nederlands
9aad05fd-040a-59f8-9b28-a5b77d7b530e,tg:lhdc:2175,e73_Descriptions,,id.desc,"Duits luisterspel van gert Hofmann. Nederlandse vertaling:  
Jef Contryn",descriptive note,Nederlands
569115d2-2f38-5dc0-a087-fae49d4a7566,tg:lhdc:1988,e73_Descriptions,,id.desc,Een luisterspel van Michel Deon. Uit het Frans vertaald door Jet Falter,descriptive note,Nederlands
c7ff4c35-d740-5be1-b356-ddab90242cae,tg:lhdc:68,e73_Descriptions,,id.desc,Programma van de Olympia in Parijs,descriptive note,Nederlands
74005399-7c43-5782-90dc-a08e0e9548de,tg:lhdc:3671,e73_Descriptions,,id.desc,Luisterspel door Ad van Seijen,descriptive note,Nederlands
819b7dc2-af54-5ca2-9282-a100dbd6e637,tg:lhdc:1169,e73_Descriptions,,id.desc,Door Arthur Schnitzler,descriptive note,Nederlands
1092dfc1-5ace-5173-84e7-0e6e5af3ceb5,tg:lhdc:2203,e73_Descriptions,,id.desc,"Luisterspel van Eduard Konig. Uit het Duits vertaald door Ward  
Ruyslinck",descriptive note,Nederlands
d0cee457-27c1-58b5-b1b4-4794729f6bba,tg:lhdc:3709,e73_Descriptions,,id.desc,Luisterspel voor de jeugd,descriptive note,Nederlands
16723181-933c-5a01-9256-12fe4646d411,tg:lhdc:78,e73_Descriptions,,id.desc,"Programma vande Folies-Bergère, Parijs",descriptive note,Nederlands
659afdc0-6002-5943-a272-2acac1961f27,tg:lhdc:1998,e73_Descriptions,,id.desc,Luisterspel van William Hanley. Uit het Engels vertaald door Ary Van Nierop,descriptive note,Nederlands
ce3449e3-d0c6-5a26-85d9-6e636c27f377,tg:lhdc:3661,e73_Descriptions,,id.desc,Door Ad van Seijen,descriptive note,Nederlands
77fc7c79-69b4-587e-91d4-1cfc64e7061d,tg:lhdc:1001,e73_Descriptions,,id.desc,"Luisterspel door Emile André Robert   
Nederlandsche bewerking door Mon De Goeyse",descriptive note,Nederlands
bc53e444-ab2b-555a-90cd-3303c685ee96,tg:lhdc:4627,e73_Descriptions,,id.desc,Deel II 1910. Boek 3,descriptive note,Nederlands
6919023e-d833-532b-92f3-2ea98b5195e5,tg:lhdc:2213,e73_Descriptions,,id.desc,"Luisterspel van Christian Bock, uit het Duits vertaald door Jozef  
Van Hoeck",descriptive note,Nederlands
9ac19f42-e1f7-53fa-a9bc-d4209754181b,tg:lhdc:1644,e73_Descriptions,,id.desc,Luisterspel van John Whiting. uit het Engels vertaald door Piet Van Aken,descriptive note,Nederlands
fdd103d9-6b71-5d9d-bfcf-160b8f416437,tg:lhdc:4062,e73_Descriptions,,id.desc,Televesiespel van Carlo Goldoni,descriptive note,Nederlands
00a305c9-1c6f-5eee-845a-30d4792a628e,tg:lhdc:3024,e73_Descriptions,,id.desc,Door Robert Carane,descriptive note,Nederlands
fb374630-ac47-50da-9406-d56a7833cc5c,tg:lhdc:2456,e73_Descriptions,,id.desc,Monoloog van Ludo Schats( Vrij naar Frankenstein door Mary Shelly),descriptive note,Nederlands
86c0023a-a896-5bdf-a54c-28ca03f66706,tg:lhdc:1654,e73_Descriptions,,id.desc,"Een sloveens lusiterspel van MAtjaz Kmecl. nederlandes vertaling:  
Andries Poppe",descriptive note,Nederlands
61cfb5e1-50d8-544e-b15b-8c5f5ba5cc75,tg:lhdc:4072,e73_Descriptions,,id.desc,Televisiespel. regie: B Struys,descriptive note,Nederlands
e9e206c1-ae9e-5e4c-9602-cd111cc355f4,tg:lhdc:2446,e73_Descriptions,,id.desc,Mini-luisterspel van Bert Van Molle,descriptive note,Nederlands
5c4dae56-3717-50f5-9ba2-27318cb8b7c0,tg:lhdc:3959,e73_Descriptions,,id.desc,Door Paul De Mont,descriptive note,Nederlands
ddfe2ac5-99f9-51ab-9f5b-f563db28c5e0,tg:lhdc:4086,e73_Descriptions,,id.desc,(le verre d'eau) of (Lee effets et les causes) door Eugène Scribe,descriptive note,Nederlands
b7015460-5a48-541a-a512-d3abcfe51e66,tg:lhdc:3821,e73_Descriptions,,id.desc,"Luisterspel voor de jeugd door Joost Kortenaer. Naar ideeën van leden  
van de club van Tante Corry.",descriptive note,Nederlands
bdfd64eb-7e0e-5dad-8e9f-1dd7ea498626,tg:lhdc:4096,e73_Descriptions,,id.desc,Door Harold Pinter,descriptive note,Nederlands
9fdb4dc9-5823-5068-aadf-65e47e2230e9,tg:lhdc:3831,e73_Descriptions,,id.desc,Luisterspel door Mary Manco,descriptive note,Nederlands
93523824-f115-53f1-a2ce-25d64f9a2abd,tg:lhdc:525,e73_Descriptions,,id.desc,"Luisterspel van Ludwig Harig  
Uit het Duits vertaald door Dries Janssen",descriptive note,Nederlands
9a10be02-9c94-5bf5-8848-920b656ae95c,tg:lhdc:3695,e73_Descriptions,,id.desc,Deel III: Het koningsexamen,descriptive note,Nederlands
59ff46fb-9bd1-5e8d-b114-b82a9a382a9e,tg:lhdc:1814,e73_Descriptions,,id.desc,"Luisterspel door Edmond Kinds, uit het Frans vertaald door Lea Martel",descriptive note,Nederlands
b75a8f7f-7e1a-5ea8-b058-66a1f8e8eb41,tg:lhdc:535,e73_Descriptions,,id.desc,"Een luisterspel van Peter Hirche  
In het Nederlands vertaald door Dries Janssen",descriptive note,Nederlands
b7a02aec-7146-55e9-a832-177de28de7b1,tg:lhdc:1393,e73_Descriptions,,id.desc,Door W.G. Van Mannen,descriptive note,Nederlands
8e6b849e-3f30-5a18-8740-8de7506364ba,tg:lhdc:2960,e73_Descriptions,,id.desc,Door Louise Vervloet,descriptive note,Nederlands
9d4f2c73-edbb-585c-970d-3bd9947d0f87,tg:lhdc:2181,e73_Descriptions,,id.desc,"Een luisterspel van Heinrich Böll. Uit het Duits vertaald door Lode  
Weyk",descriptive note,Nederlands
abc45446-339f-5837-938f-40fff321138c,tg:lhdc:2818,e73_Descriptions,,id.desc,Door Jacques Isderda,descriptive note,Nederlands
4e48d5c4-40c4-545e-849f-10544e12a58e,tg:lhdc:1383,e73_Descriptions,,id.desc,Gracchus Babeuf,descriptive note,Nederlands
fe4bcb45-93a8-5c93-aa00-b3ee145d6be5,tg:lhdc:2970,e73_Descriptions,,id.desc,Door Friedrich Feld,descriptive note,Nederlands
98d6e071-ecdb-5878-a177-6c92ed0e8846,tg:lhdc:653,e73_Descriptions,,id.desc,Door Alfred Karratch,descriptive note,Nederlands
5322f388-c7ab-5093-b1c6-d234320b5378,tg:lhdc:2808,e73_Descriptions,,id.desc,Door G. Selleslags-Vielsen,descriptive note,Nederlands
69b18b18-bbe4-5c3f-8fce-82f5a18111df,tg:lhdc:4288,e73_Descriptions,,id.desc,"Een éénakter van Glenn Hughes, uit het Amerikaans vertaald door  
Wim Gansemans.",descriptive note,Nederlands
7c4666bc-f101-5cc6-91fe-e97998163d32,tg:lhdc:4474,e73_Descriptions,,id.desc,Aflevering 27,descriptive note,Nederlands
efbef7a8-f4d6-5d43-9fdb-20a0d045a6c7,tg:lhdc:1252,e73_Descriptions,,id.desc,Door Hans Sahl,descriptive note,Nederlands
89737540-8aa1-58fa-9a7f-ac111dadacf5,tg:lhdc:782,e73_Descriptions,,id.desc,"Liane Bruylants   
Voor de radio bewerkt door Bert Brauns",descriptive note,Nederlands
5e531b47-bc20-553d-82d4-6e40ba225555,tg:lhdc:2138,e73_Descriptions,,id.desc,Door Antonio Skarmeta,descriptive note,Nederlands
658df167-3fb6-52b3-a87e-0b9da41c18fe,tg:lhdc:2050,e73_Descriptions,,id.desc,Een luisterspel van Ernest Milton. Uit het Engels vertaald door Jan Geysen,descriptive note,Nederlands
c29ef471-ebb9-5ae7-8549-073aa3fa27b1,tg:lhdc:3422,e73_Descriptions,,id.desc,Door Jenny Smelik-Kiggen,descriptive note,Nederlands
4f8c4f92-a333-5302-9fce-89e57b71929a,tg:lhdc:2128,e73_Descriptions,,id.desc,Luisterspel van Gerry Jones. Uit het Engels vertaald door Frits Enk,descriptive note,Nederlands
681c7617-d2e5-5d48-bf65-614f939d1768,tg:lhdc:1242,e73_Descriptions,,id.desc,Naar het werk van Charles De Coster door Mevr. Hilde Brant,descriptive note,Nederlands
e042fe0d-2205-5145-91b0-0d6eb8e07250,tg:lhdc:792,e73_Descriptions,,id.desc,"Luisterspel ter gelegenheid van de 650e herdenking van de Guldensporenslag 
Door Cyriel de Corel",descriptive note,Nederlands
89bf9482-e697-5d4a-ad06-7f6703241d21,tg:lhdc:2615,e73_Descriptions,,id.desc,Luisterspel door H.R.F. Keating,descriptive note,Nederlands
d8e02ae0-ed5f-5e1e-a95e-ffdb53d47e60,tg:lhdc:936,e73_Descriptions,,id.desc,"Een luisterspel door Alejandro Casona, uit het Duits    
vertaald door Georgette De Rijcke",descriptive note,Nederlands
44436263-18ac-592c-85d5-797d105ce513,tg:lhdc:4221,e73_Descriptions,,id.desc,Door Samuel Beckett,descriptive note,Nederlands
962a55fb-bde0-573b-a865-78e14c69090d,tg:lhdc:926,e73_Descriptions,,id.desc,"Een luisterspel naar aanleiding van haar heiligverklaring in het H. jaar.   
Vrij bewerkt naar het filmscenario van Augusto Genina door Toon Rammelt",descriptive note,Nederlands
956d34a3-5e22-54ed-94ab-1e4f9a127519,tg:lhdc:2605,e73_Descriptions,,id.desc,"Een hoorspelletje naar het gelijknamige verhaal van Godfried  
Bomans, voor de radio bewrkt door Jo Crab  
  
",descriptive note,Nederlands
f7947d8f-edc6-5201-908e-cad18282ea8f,tg:lhdc:3277,e73_Descriptions,,id.desc,Door Elisabeth T'Seyen,descriptive note,Nederlands
17a7c790-72f9-564f-814f-0eaffb2e9eca,tg:lhdc:4231,e73_Descriptions,,id.desc,Door Roger van de Velde,descriptive note,Nederlands
e274335c-8c14-5765-b258-b7cc9e30f6ed,tg:lhdc:1417,e73_Descriptions,,id.desc,"Een alledaagse geschiedenis in twaalf staties  
Stereo-luisterspel van Andries Poppe",descriptive note,Nederlands
c9e037f6-495f-55a7-84b9-18c66814b73b,tg:lhdc:2573,e73_Descriptions,,id.desc,Radioschets door Jac Ballings,descriptive note,Nederlands
925f17b2-d538-5ec3-82ad-c0f9bf1cf6e9,tg:lhdc:1619,e73_Descriptions,,id.desc,Luisterspel door Mr. De Praetere,descriptive note,Nederlands
02293b03-d9a0-52d7-aef8-bf15157d0c05,tg:lhdc:4147,e73_Descriptions,,id.desc,Een monoloog naar het boek van Elisabeth Marain,descriptive note,Nederlands
0d1a81e7-799e-5c1c-ac1b-3d8bfbf34cde,tg:lhdc:3898,e73_Descriptions,,id.desc,Gevariëerd luisterspel,descriptive note,Nederlands
1b50856c-aa52-540e-a5a8-dade7afc36e5,tg:lhdc:1609,e73_Descriptions,,id.desc,"Luisterspel door Dr. Leo Matthias. Uit het Duitsch door Dr. Mon  
De Goeyse
",descriptive note,Nederlands
fd9f3e01-3d22-5d09-9993-f69f21abf85a,tg:lhdc:2563,e73_Descriptions,,id.desc,"Luisterspel door Tankred Dorst. Uit het Duits vertaald door Willem  
Tollenaar",descriptive note,Nederlands
61b8809a-0ef7-5d9e-a9f3-33eede722df3,tg:lhdc:1771,e73_Descriptions,,id.desc,"Luisterspel door Eduard König, uit het Duits vertaald door Bernard Kemp",descriptive note,Nederlands
5c6308c3-6e6b-579c-81ce-501659d60767,tg:lhdc:3888,e73_Descriptions,,id.desc,Door Julia Willems,descriptive note,Nederlands
d806396c-4698-5c0c-9271-cad5aead578f,tg:lhdc:4157,e73_Descriptions,,id.desc,Door Rose Gronon,descriptive note,Nederlands
bc257f21-4968-5f67-b57f-818236ea2fe4,tg:lhdc:2326,e73_Descriptions,,id.desc,"Luisterspel van William Leonard Marshall. Nederlandse vertaling;  
Julien Van Remoortere",descriptive note,Nederlands
3166e02b-f27c-54ea-8a31-d39158d19871,tg:lhdc:35,e73_Descriptions,,id.desc,Programma voor het optreden in Antwerpen van het Grand Cirque Russe,descriptive note,Nederlands
4c7c82d7-0185-51a0-9521-17e62e512c7d,tg:lhdc:3754,e73_Descriptions,,id.desc,Gevariëerd luisterspel,descriptive note,Nederlands
99ea403e-a119-5bf2-b3df-1504ac474397,tg:lhdc:1134,e73_Descriptions,,id.desc,Door Karel Capek,descriptive note,Nederlands
ee3d7a59-3c1f-5bc1-9598-ac9e96b30ff0,tg:lhdc:4712,e73_Descriptions,,id.desc,Luisterspel door Julia Tulkens,descriptive note,Nederlands
4cd1aa37-3736-5876-955d-03185996df10,tg:lhdc:25,e73_Descriptions,,id.desc,Vioolconcert van Charles Bouvet in het Koninklijk Kunstverbond (Antwerpen),descriptive note,Nederlands
757fb61f-9e0f-5f9b-bf10-5116c6a43dcc,tg:lhdc:2336,e73_Descriptions,,id.desc,"Naar een toneelstuk van Roger Van Ransbeek, bewerking en regie  
Michel De Sutter",descriptive note,Nederlands
4bbde1a3-9ab1-5dc8-9391-eacc16c321d9,tg:lhdc:3744,e73_Descriptions,,id.desc,Gevariëerd luisterspel,descriptive note,Nederlands
f9c425b9-4d1c-5361-b43c-d4864cd52f2e,tg:lhdc:2344,e73_Descriptions,,id.desc,Luisterspel van Miklos Gyarfas. Nederlandse vertaling: Paul Hardy,descriptive note,Nederlands
b209b6e7-9bda-5e68-ade2-e5e7bb1d2397,tg:lhdc:57,e73_Descriptions,,id.desc,Programma van de Moulin Rouge in Parijs,descriptive note,Nederlands
3906da15-3edd-5a4a-94dc-27aaf32799bf,tg:lhdc:486,e73_Descriptions,,id.desc,"Naar een toneelwerk van Fritz Hochwalder
bewerkt door W. Semmelroth
Nederlandse vertaling: Jos De Haes",descriptive note,Nederlands
fdd7bf87-bf34-5b2e-9dac-242ece68cd38,tg:lhdc:1156,e73_Descriptions,,id.desc,Schets door László Békeffi,descriptive note,Nederlands
10e8e125-fe39-58b4-a401-3b02e9f75abf,tg:lhdc:3736,e73_Descriptions,,id.desc,Mengelluisterspel,descriptive note,Nederlands
cb768a66-8583-559a-b2cc-fa0cfca996fd,tg:lhdc:47,e73_Descriptions,,id.desc,"Programma voor de pantomine ""Pierrot Rouge",descriptive note,Nederlands
6f9f46e6-113a-5354-8948-50583c164143,tg:lhdc:3726,e73_Descriptions,,id.desc,Een Tijldrats door E. Picavet,descriptive note,Nederlands
9cccb5f9-cb35-5e10-9269-abf558f0eec8,tg:lhdc:496,e73_Descriptions,,id.desc,"Luisterspel door Dan Treston  
Uit het Engels vertaald door Ward Ruyslinck",descriptive note,Nederlands
92e45105-e195-5f61-8a71-2f5aad10eab8,tg:lhdc:3982,e73_Descriptions,,id.desc,Door Henry Denker,descriptive note,Nederlands
fa2985ef-799d-5b24-b59a-7de22672bcb5,tg:lhdc:2511,e73_Descriptions,,id.desc,"Drama in drie minute door Ferdinand Altenkirch. Uit het Duitsch door  
Leo Persijn.",descriptive note,Nederlands
2b306cb9-d499-51a8-ba3f-29c7e46de727,tg:lhdc:1703,e73_Descriptions,,id.desc,Luisterspel van Henning Mortensen. Vertaling: Tuuk Buijtenhuijs,descriptive note,Nederlands
555a1622-3898-5ae6-a625-8fe66572c6c1,tg:lhdc:4125,e73_Descriptions,,id.desc,TV-spel naar novelle van H. Lang door A. Van Calsteren,descriptive note,Nederlands
4fc2ebbd-5d3f-54c3-8760-d83aae720e07,tg:lhdc:2469,e73_Descriptions,,id.desc,Documentair luisterspel van Jacques Seraes en Werner Verstraeten,descriptive note,Nederlands
8a18a1d7-df7b-57bb-bdf8-8830fae4f064,tg:lhdc:2501,e73_Descriptions,,id.desc,"Een luisterspel van Francis Durbridge. Nederlandse vertaling: Luc  
Van den Broeck",descriptive note,Nederlands
ca9c5edc-390a-58d3-834c-480340005d8d,tg:lhdc:3992,e73_Descriptions,,id.desc,Drama department door Edward Bond,descriptive note,Nederlands
41c01ab3-27ba-557d-9775-048d019a0e18,tg:lhdc:2479,e73_Descriptions,,id.desc,Auteur: Adolf Muschg,descriptive note,Nederlands
8cc81eca-dc45-5a77-9574-cb5520115c71,tg:lhdc:3173,e73_Descriptions,,id.desc,Door Felix de Moor,descriptive note,Nederlands
936523ec-df5b-57f3-a100-1d3e9e9acce6,tg:lhdc:954,e73_Descriptions,,id.desc,Radiophonische schets door Mv. Mostkova - Lamblot,descriptive note,Nederlands
cff907ec-a113-5541-a61e-568f826f5b46,tg:lhdc:3205,e73_Descriptions,,id.desc,Door Medy Dona,descriptive note,Nederlands
67538351-6afd-5f6f-b8b0-1a8e1094612e,tg:lhdc:4243,e73_Descriptions,,id.desc,D. Campton,descriptive note,Nederlands
046af0f1-686c-51a1-adf3-1e412b4a9494,tg:lhdc:1465,e73_Descriptions,,id.desc,Door Charles Cordier; uit het Frans vertaald door René J. Seghers,descriptive note,Nederlands
d490100b-568a-59e4-8e31-6f5673147b86,tg:lhdc:944,e73_Descriptions,,id.desc,"door John Manchip White   
Vert.: Hubert van Herreweghen",descriptive note,Nederlands
6cb9d740-cb81-54ee-b797-25dc1bb545cc,tg:lhdc:4253,e73_Descriptions,,id.desc,Door A.B. Shifrin,descriptive note,Nederlands
7db6dfe6-fa32-5d0b-817e-a964e4866d9c,tg:lhdc:1475,e73_Descriptions,,id.desc,Luisterspel van Peter Hemmer. Nederlandse vertaling: Paul Vroom,descriptive note,Nederlands
524eef13-0a2e-5fe2-91c6-64a4e2bdfaba,tg:lhdc:3215,e73_Descriptions,,id.desc,Door P. Willaert,descriptive note,Nederlands
a3215be0-1c58-5e76-a6df-7e0601e7831f,tg:lhdc:3528,e73_Descriptions,,id.desc,Oorspronkelijk Sinterklaasluisterspel door Lou Mourik,descriptive note,Nederlands
815db3e8-919e-5bd2-a0b0-cb8cf85391b7,tg:lhdc:2022,e73_Descriptions,,id.desc,"Tekst voor een akoestische kreatie door Ingeborg Drewitz. Vertaling:  
Marc Colpaert",descriptive note,Nederlands
f75f29b4-3ca0-5d73-b57c-80f553944fdc,tg:lhdc:698,e73_Descriptions,,id.desc,"Naar het Engels van John Gay  
In de bewerking van Bert Brecht  
op muziek van Karl Weil",descriptive note,Nederlands
1bb63be9-729e-5a67-aa24-fccebc7b1e8f,tg:lhdc:1348,e73_Descriptions,,id.desc,Door Augier en Sandeau vertaald door Top Naeff,descriptive note,Nederlands
e0c662d5-09d2-5428-b312-a44acda905fc,tg:lhdc:688,e73_Descriptions,,id.desc,Door J.L De Belder,descriptive note,Nederlands
96bc28d9-fb84-5e29-9480-be25198214a4,tg:lhdc:1358,e73_Descriptions,,id.desc,Hoorspel in vijf schuifkens door Antoon Thiry,descriptive note,Nederlands
fd93b421-0550-5112-adb1-3469c97390c8,tg:lhdc:3538,e73_Descriptions,,id.desc,Hoorspel geschreven door Louis Duseé,descriptive note,Nederlands
0a570ec8-e5cf-5910-9809-8bfb8a26402a,tg:lhdc:2032,e73_Descriptions,,id.desc,Luisterspel van Don Haworth. Uit het Engels vertaald door Nora Snyers,descriptive note,Nederlands
5a93983d-0f9b-560e-ad29-adde02101561,tg:lhdc:895,e73_Descriptions,,id.desc,Door Lies de Leeuw,descriptive note,Nederlands
3d7671a6-89b1-5ac5-a277-12db0104c58d,tg:lhdc:885,e73_Descriptions,,id.desc,"Vrij bewerkt naar Sophokles door J. Cocteau,   
vertaald en voor de radio bewerkt door Pieter G. Buckinx.",descriptive note,Nederlands
c8d6263b-5ebf-55b4-963a-c5cd4197908a,tg:lhdc:621,e73_Descriptions,,id.desc,"Luisterspel van Guenter Eich  
Uit het Duits vertaald door Georges van Vrekhem",descriptive note,Nederlands
493eb4f0-59e0-5c29-a2cf-fd79e3c1b268,tg:lhdc:2902,e73_Descriptions,,id.desc,Door Rud Feenstra,descriptive note,Nederlands
d9fd0448-2226-51d3-a7dd-0fae9a6f4eb8,tg:lhdc:3591,e73_Descriptions,,id.desc,Luisterspel door Theo Luysterburg,descriptive note,Nederlands
be1568a0-6e5e-510b-958b-1dd7014af571,tg:lhdc:759,e73_Descriptions,,id.desc,"Luisterspel door Roger Clausse   
Naar het blijspel van Plautus  
Nederl. vert. : Jos De Haes  
Muziek van Gaston Brenta

",descriptive note,Nederlands
b90e2e34-b57d-5f8a-b21d-623c0cd73390,tg:lhdc:3581,e73_Descriptions,,id.desc,Door Ad. van Seijen,descriptive note,Nederlands
02a290ef-3459-5c79-b262-06b27e4fbf07,tg:lhdc:631,e73_Descriptions,,id.desc,"Een Italiaans luisterspel door Paolo Levi  
Nederlandse vertaling: Georges van Vrekhem",descriptive note,Nederlands
dadff22f-59ee-5435-966d-e9f35f1f3f17,tg:lhdc:749,e73_Descriptions,,id.desc,Luisterspel door Frans Dirickx,descriptive note,Nederlands
ccfb144d-6c4e-538b-ad3c-a874b606a0ce,tg:lhdc:1299,e73_Descriptions,,id.desc,"Klucht in een bedrijf naar Breughel door Michel De Ghelderode  
Nederlandsch van Jozef Contryn",descriptive note,Nederlands
3996dfe8-9386-5860-b16e-00c66217be24,tg:lhdc:547,e73_Descriptions,,id.desc,"Door Mirko Bozic  
Uit het Duits vertaald door Lode Vandeput",descriptive note,Nederlands
3f4cc389-d2e6-5d52-b6eb-0dcf88422fde,tg:lhdc:1876,e73_Descriptions,,id.desc,"Geen politiebericht door Alfred Anderson. Uit het Duits vertaald door  
Paul Van Morckhoven",descriptive note,Nederlands
8ac49ba1-af1b-5d3f-8224-44c48ea8316d,tg:lhdc:2285,e73_Descriptions,,id.desc,"Luisterspel van Seamus Mc Gonagle. Uit het Engels vertaald door Piet  
Van Aken",descriptive note,Nederlands
0eb3f7a3-7cc7-5bb5-b828-c36f75065336,tg:lhdc:557,e73_Descriptions,,id.desc,"Een luisterspel door Lionel Brown  
Uit het Engels vertaald door Georgette De Rijcke.",descriptive note,Nederlands
94e8db41-ea68-5237-8e53-4b9129d94605,tg:lhdc:1866,e73_Descriptions,,id.desc,"Luisterspel door Leopold Ahlsen. Uit het Duits vertaald door  
Carlos Tindemans",descriptive note,Nederlands
